{
  "format": "adversarial_policy_carla_repeat_plan_v1",
  "source_plan": {
    "root_env": "PROJECT_OUTPUT_ROOT",
    "relative_path": "adversarial_policy_carla_plan_v1/20260821_202710/run_plan.json"
  },
  "selected_pair_ids": [
    "apcv1_pair_02",
    "apcv1_pair_07",
    "apcv1_pair_08"
  ],
  "traffic_manager_seeds": [20260824, 20260825, 20260826],
  "validate_scene_configs": true,
  "output_subdirectory": "adversarial_policy_carla_repeat_plan_v1",
  "runtime_output_subdirectory": "adversarial_policy_carla_repeat_v1"
}
